ID,output
ID_11040,"여행을 많이 다니고 국내든 해외든 5성급 이상 호텔 아니면 안 가는데 가격이 저렴해서, 맘에 안 들면 그냥 지나치자 하는 마음으로 예약을 했는데, 오와! 직접 와보면 가구, 소품, 욕실 인테리어 등 정말 신경 써서 운영하시는 게 느껴져요. 침구류까지도 매우 고급스럽고 깔끔해요. 주차 시설도 넓고 편해요! 이런 가성비 좋은 기분 좋은 곳은 전국 어디에도 없을 듯! 옆에 롯데마트도 있고, 주변에 그래도 먹을 만한 식당들이 있어서 더 좋아요."
ID_01060,동해안 종주 중 3만 원에 숙박. 배달은 통닭밖에 안 됩니다 ㅜㅜ 자전거 객실 안에는 안 되고 복도 가능. CCTV가 있어서 괜찮다고 하심. 담배 냄새 비슷한 게 조금 나긴 하지만 가성비 좋음.
ID_10757,"콘센트 안 됨. 방 안 바꿔줌. 머리 안 말려도 되고, 폰 충전 안 해도 되는 분만 가세요~ 타 플랫폼 후기에는 바퀴벌레 나왔다고도 하고 이래저래 다시는 안 갈 곳입니다."
ID_03444,싼 가격에는 다 이유가 있는 법. 기본적인 청소도 제대로 안 되어 있네요.
ID_01069,"3/8 댓글 알바임. 담배 냄새 극혐, 너무 심하고 방충망 고장 나서 창문도 못 열음. 3/8 후기에 속지 마세요. 옆에 모텔에 똑같은 후기 있음."
ID_10716,엘리베이터 이용 너무 힘들어요. 늦은 체크인 시에...
ID_02205,"문 꼭 걸어 잠그고 주무세요. 체크아웃 시간도 되지 않았는데 직원분이 그냥 문을 열고 들어오셨어요. 눈이 마주쳤는데도 불구하고 그냥 나가셨어요. 그 뒤로 아무 연락도, 사과도 받지 못했어요. 체크아웃하면서 체크아웃 시간을 잘못 알았나 싶어서 물어보니, 그제서야 전달이 잘못돼서 직원분이 실수했다고 사과하시는데, 직원분한테 전달받자마자 룸 전화로든 안내를 바로 해주셔야 했다고 생각해요. 대처가 많이 아쉬웠습니다."
ID_09435,제가 불면증이 좀 있었는데 해운대 야경 보면서 오랜만에 꿀잠 잤어요.
ID_07339,"예약하고 보니 평점이 안 좋아서 당황했는데 ㅎㅎ 평점을 올려주려고 굳이 글을 쓸 만큼 좋았어요. 깔끔하고, 직원들도 친절하고, 뷰 맛집입니다."
ID_08208,"바다 뷰가 좋을 것 같아서 예약했으나 앞에 빌딩이 올라가 있고 넓게 공사하는 모습만 보여 실망했습니다. 차라리 시티 뷰가 훨씬 좋았을 듯. 전반적으로 서비스가 좋은 편이며, 에어컨 온도를 낮춰 놔도 잘 내려가지 않는 게 단점입니다."
ID_07679,전체적으로 깨끗하고 쾌적해요! 화장실도 너무 깨끗!! 베개 선택하는 서비스도 재밌어요. 가격 대비 최상의 만족도입니다^^ (주차 불가가 아쉬워요ㅠ)
ID_04642,"방이 엄청 넓고 깨끗하며, 뷰까지 좋습니다~~ 힐링 제대로 했어요ㅎㅎㅎ"
ID_07683,301호 생각보다 정말 좁음. 발코니로 통하는 문은 안 잠김. 주변에 먹을 거 꽤 있어서 좋아용. 뷰는 전봇대 뷰 + 오션 뷰.
ID_09007,"주변에 국회도서관, 스타필드, 롯데시네마도 있어서 편리해요. 가격도 합리적이고 조식도 가짓수는 적지만 깔끔해요."
ID_07996,"태백을 매년 방문했는데, 어설픈 콘도보다 시내 한가운데서 먹거리와 술 한 잔 하기 좋네요. 딱 깔끔한 모텔, 주차 편하고."
ID_05600,"넓은 루프탑 카페는 부산 전경을 보기에 충분했습니다. 로비에서 친절함이 느껴져서 좋았고, 다음에 또 부산에 온다면 라바사 호텔입니다."
ID_09151,지은 지 얼마 안 돼서 정말 깨끗하고 좋네요.
ID_07022,"정말 만족스러웠던 호텔. 낮에 보는 뷰, 해가 질 때 보는 뷰 둘 다 미쳤어요. 객실은 유럽풍 스타일로 고풍스럽고, 모든 시설이 만족스러웠어요! 수영장과 야외 노천탕도 있는데 마찬가지로 뷰가 예술이에요. 조식은 합격! 단, 전 한식을 좋아하는데 프랑스 체인이라 빵 종류가 많은 편이에요. 물론 한식도 있고 맛도 좋아요. 5성급 호텔이라 직원들도 친절했어요."
ID_04893,"가성비가 좋고 방 크기도 꽤 큰 편인 점은 만족하지만, 상당히 낡은 게 느껴지는 룸 컨디션은 아쉽습니다... 호캉스 느낌 내기엔 부적합하고 출장용으로 추천해요."
ID_00225,"장점: 거의 모든 게 비대면. 스마트한 환경 덕에 사람 부대낄 일이 없어서 일이건 쉼이건 목적에 맞게 지낼 수 있음. 북끝서점과 연계되어 다양한 주제로 배치된 책 공간이 진심 좋았음. 청소하시다 지나갈 때마다 인사해 주시는 직원분들의 다정함도 좋았음. 안마 기계, 고개를 들면 보이는 바다 뷰, 깔끔한 공용 주방에서 무료 제공되는 커피 및 식빵, 호텔처럼 바스락거리는 깨끗한 침구... 단점: 밟아도 잘 나가지도 않는 오랜 레스포 마실용 자전거(인스타 감성용) 1시간 이용에 5000원은 과도하지 않나... 데크도 해변가에 짧게 있어서 실제 자전거 탈 곳이 미비. 도로로 나와도 차들이 계속 다녀서 자전거 타기 위험함. 다른 방은 모르겠고, 4인 도미토리는 절대 가지 말 것. 모든 장점을 다 무너뜨리는 엄청난 곳임. 층간 소음 매우 심하고 같은 방 사람들 걷는 것도 울려서 침대에서 고스란히 느껴짐. 침구는 깨끗한데 매트리스가 구려 허리가 아작남. 2층 침대인데 커튼 치면 완전 개인주의 환경 가능.... 할 줄 알았으나 방에 코골이, 잠꼬대 빌런 있으면 절대 못 잠. 그 밤을 서로 얼굴도 못 본 채 어디에서 온지도 모를 사람들과 닫힌 커튼 안에서 한숨만으로 연대해야 함. 이틀 연박했는데 매일 빌런 한 명씩 있었음. 그날 빌런 없으면 자기가 숨은 빌런일 수도 있으니 코골이 심한 자는 양심적으로 도미토리 방 가지 말 것. 도미토리 7만 원 가성비 별로임. 가격이 그 이하면 괜찮을지도... 속초에 싸고 더 좋은 숙소 있음. 아마 일도 거기서 더 잘 될 거임. 내 상황상 고성에 왔다가 불가피하게 머물다 보니 긍정의 힘으로 버텼는데 다신 안 감. 이런 후기 안 쓰는데 세련된 척하면서 내실 없는 것, 맹그로브에서 세심하게 제공해 준 귀마개가 감사했지만 이를 무용하게 만들 만큼 탱크 버금가는 코골이 소리, 귀신처럼 웃던 잠꼬대 빌런 때문에 열받아서 남김. 차라리 12~16만 원인 2인 실을 추천함. 1인이라면 그 가격에 주변 환경 고려해서 다른 곳 가는 게 나음."
ID_03354,뷰가 너무 좋아요! 또 오고 싶어요!
ID_05895,깔끔한 룸 컨디션에 수준급의 조식까지… 다만 라운지 이브닝 칵테일의 핫푸드 섹션의 퀄리티가 좀 부족하다.
ID_10677,말로 할 수 없을 정도로 아름다운 곳입니다. 아름다운 건축물 자체가 주는 즐거움이 상당하다는 걸 알았어요. 바다와 함께 완벽한 힐링을 즐기고 왔습니다. 봄에 다시 가려고요.
ID_08754,"호텔 급의 서비스 마인드 프리미어 객실, 이상 호텔 시설과 견줄 만함."
ID_03436,윗집이 공사하느라 시끄러워서 피난 겸 호캉스 다녀왔어요. 방이 좀 좁지만 룸 컨디션 좋고 조식 재료가 싱싱한 것 같았어요. 잘 쉬다 갑니다.
ID_01693,"위치, 청결, 친절 등 여러 면에서 만족합니다."
ID_06893,"1. 혼자 쓰기 좋다. 혼자 부산 여행 왔는데 혼자 여행 올 때 여기만한 데가 없는 것 같음. 엄청 깔끔하고 심플한데 있을 건 다 있음.   2. 뷰가 미쳤다. 광안리 바로 앞에 있는 호텔이라서 진짜 미침. 바다 좋아해서 다음 생에 돌고래로 태어나고 싶은 나는 백튬블링함.   3. 사진 찍으면 이쁘게 나옴. 방에서 찍어도 이쁘지만 10층에 루프탑 카페가 있는데 작정하고 포토존 만드신 듯, 사진 진짜 예쁘게 나옴. 물론 나는 사진 찍는 거 안 좋아해서 그냥 카페 사진만 찍어옴.   4. 시설이 좋다. 무료 와이파이, 조식 제공, 1, 2층 카페 있으니까 저는 만족함.   5. 그냥 이쁨. 개인 취향이긴 한데 저는 이렇게 심플하고 깔끔한 데가 너무 좋음. 그냥 다 좋음. 부산에 1박 2일인데 이 호텔 때문에 하루만 더 묵고 싶어짐... 여기 꼭 오세요."
ID_01045,좋아요. 깔끔하고 조식도 맛있어요. 그런데 한국인을 위해 만들어진 호텔 같지는 않네요ㅋㅋ 약간 다 낮고(제가 평균 키인데도) 조식은 일본식이에요. 일본은 현지화를 전혀 안 하는 편인가 봐요ㅋㅋ
ID_03446,숙소 뷰와 컨디션이 아주 미쳤어요. 너무 좋아요.
ID_08050,지금 5만원인데 당일 취소당할까봐 무서워서 예약할 수가 없네요…
ID_09146,전체적으로 괜찮은 듯.
ID_11242,"위치 좋고 가성비가 좋습니다. 호텔 내 사우나도 있고 시설도 좋으며 저렴하고 깨끗합니다. 삼진어묵, 던킨, CU도 호텔 내에 있어 유용합니다. 부산역이 코앞이라 위치도 매우 좋습니다."
ID_10927,깔끔하고 비용도 저렴해서 만족했어요. 시설도 이 정도면 괜찮네요.
ID_04735,오션 프리미엄 터치뷰가 너무 좋아서 힐링하고 갑니다. 또 오고 싶어요.
ID_04496,깨끗하고 룸 컨디션이 아주 좋아요. 화장실은 정말 깨끗합니다. 설악에 올 때마다 머물고 싶어요.
ID_01218,친절하고 뜨시고 이만한 데 없습니다.
ID_06015,"사진 이렇게 설정해놓으셨으니 당연히 수영장 이용 가능한 줄 알고 예약 후 확인해보니 시기가 지나서 안 된다. 제대로 확인 못한 제 잘못도 있지만 일단 사진을 봤을 때 누가 이용 못 할 거라 생각할까요. 그거 관련해서 연락 드렸더니 사진이 어떻게 올라가 있든 자기들 시설이 맞고 확인 안 한 그쪽 잘못이라고 당당하게 이쪽 책임으로 100% 넘기려고 애쓰시고 수영장 이용 가능 불가능 떠나서 꼬우면 그냥 오지 말라는 식으로 말씀하시니 갈 마음이 당연히 사라집니다. 충분히 헷갈릴 만한 사유였던 것 같아서 연락을 드린 건데 결국 달라지는 건 하나도 없었네요! 31만원 결제하고 묵지도 않고 2만원 돌려받네요ㅋ 전화 응대, 인성 최악입니다! 숙소는 가면 좋아 보이지만 다른 분들은 괜한 트러블 생기지 않으시길!!"
ID_09719,또 가고 싶어요…ㅠㅠ 흠잡을 곳 없는 곳
ID_03987,방도 너무 깨끗하고 사장님도 너무 친절하셨어요. 날이 쌀쌀했는데 방도 엄청 따뜻했어요. 뷰도 바다가 보여서 아침에 일어나 바다가 보이니 너무 좋았어요. 다음에도 또 방문하려고 합니다.
ID_04911,"카운터에 있는 여자 직원, 진짜 불친절해요. 일하기 싫으면 집에 가세요."
ID_09492,비싸지만 비싼 것 이상으로 대접해주는 곳. 조식 뷔페에 나온 후르츠 로마노프 어디서 찾아요…?
ID_04493,"숙소 뷰가 너무 좋았어요 :-) 가성비도 좋고, 주위에 낙산공원도 가깝고 창경궁도 있어서 만족했어요. 다음에는 루프탑 스위트 룸에도 머물고 싶네요 :-)"
ID_06944,"일단 중간이라는 곳에 푹 박혀 있는 느낌. 그곳에 덩그러니 높지 않지만 조금 높은 곳에서 중구를 바라보면서 옛 추억을 상기하기 좋은 장소이며, 주위에 장충단 소소한 쇼핑 거리가 쭉 형성되어 있는 곳입니다. 한적하게 나와서 산책도 하고 구경도 병행하면서 사는 사람의 모습도 볼 수 있는 곳이라서 행복한 곳입니다. 이곳이 바로 신라 호텔의 장점입니다. 있는 자나 없는 자나 항상 그 자리, 그곳에서 묵묵히 살아내고 잘 하고 있는 호텔인들에게 수고와 감사를 보냅니다."
ID_05699,남자친구랑 너무 재미있게 즐기다가요! 정말 재미있게 보냈습니다. 굳 
ID_08352,"부산 올 때마다 기념일 날 부모님이나 아내를 데리고 한 번씩 가지만, 갈 때마다 진짜 좋아요. 그래도 너무 기대치를 높게 가지는 않으면 좋겠어요..ㅠㅠ"
ID_00956,진짜 좋았다. 마음 같아서는 10점을 주고 싶을 정도… 뷰가 끝내준다. 객실 깔끔하고 시원하다. 이 가격에 이런 오션 뷰? 무조건 예약 제발.
ID_02869,"이곳 평이 왜 좋은지 모르겠네요. 특별히 나쁜 것도 아니지만 좋은 것은 더더욱 아닙니다. 시설이 많이 낡았고 특별히 친절하거나 서비스 시설이 있지도 않습니다. 주위에 호텔, 모텔이 상당히 많구요. 다만 그나마 주차장은 여유가 있어 보입니다. 저렴한 곳을 찾을 때 그리고 그냥 가성비로 방문할 만한 곳입니다. 절대 일부러 찾아올 곳은 아닙니다."
ID_04433,불쾌해..
ID_04973,아주 만족스러웠습니다.
ID_02961,친절하고 깨끗하며 저렴함
ID_02200,가격이 들쑥날쑥... 어제 금요일날 갔는데... 십오 만 원 받네요... 가격 대비 너무 엉망... 웬만한 모텔만도 못하면서 가격은 왜 그렇게 비싼지... ㅉㅉㅉ
ID_00098,가격 대비 깨끗한 침구류와 친절하신 사장님 덕분에 잘 쉬다 갑니다.
ID_11090,아난티 말해모해 다 좋은데 뷔페 진짜 하... 음식 다 짜고 달고.... 콜라 250ml에 6천원ㅋㅋㅋㅋㅋㅋㅋ 주변에 식당 없고 접근성 구리니까 너무 속보이게 장사하네요.... 디너 뷔페 절대 가지 마세요..
ID_02557,일단 슬리퍼를 신고 돌아다니는 곳이라 그런지 바닥도 엄청 깨끗해서 좋았습니다. 방에 들어가자마자 이렇게 광안대교가 예쁘게 보이는데 정말 너무 예뻐서 사진만 하루종일 찍은 것 같아요!! 너무 예쁘고 좋았습니다 ㅎㄹ
ID_08445,오션뷰 센터를 이용했습니다~ 뷰가 너무 예뻐요... 광안대교를 제대로 볼 수 있는 호텔입니다!
ID_04199,수영장 클럽 디 오아시스로 대체 가능한 메리트가 줄어듭니다. 직원들이 굉장히 친절합니다.
ID_09637,"청소 최악. 들어가자마자 바닥에 누가 먹었는지 모를 과자 봉지와 사용한 마스크, 먼지들이 반겨줌ㅋㅋ. 의자 위엔 머리카락이 잔뜩.. 진짜.. 더러워......"
ID_05539,"너무 더워요~~~~ 에어컨은 작동 안 하고 히터는 못 끄고, 창문 열어놔도 덥고"
ID_01648,깨끗하고 바다 전망이 정말 좋았어요. 방도 따뜻하고 스파 시설도 있어서 피로 풀기도 좋았네요
ID_09888,"카카오맵은 직접 방문(예약)하지 않아도 후기를 작성할 수 있게 되어 있네요. 아래 후기가 제 경험과 너무 달라서 믿기 어렵습니다. 저는 15일부터 이틀을 나비야에서 보내고 있습니다. 어제 닭갈비 바비큐도 즐거웠고(닭갈비 맛집이니, 오시는 분들은 꼭 바비큐를 신청하세요), 오늘은 낮부터 저녁 동안 혼자서 편하게 공용 공간에서 풍광을 보고 커피 마시며 책 읽고 일했습니다. 편하고 만족스러운 시간을 보내고 있습니다. 무심하게 이거저거 배려해 주시는 사장님께도 감사드립니다. 종종 와서 시간을 보내고 싶은 곳입니다. 물론 당연히 여기는 게스트하우스이고 한옥이니 그에 따른 규칙이 있고, 사람마다 같은 경험이라도 평가가 다를 수 있다고 생각해요. 그럼에도 근거 없는 비방은 문제겠죠."
ID_06197,캡슐 호텔들 여럿 가봤는데 이렇게 위생이 신경 쓰이지 않는 곳은 처음이에요! 화장실이 공용이어도 이렇게 편리할 수 있구나 처음 깨달은 곳이에요. 곳곳에 투숙객을 위한 배려가 넘칩니다.
ID_06295,프론트 여직원이 불친절합니다. 지난번 남자 직원도 불친절했습니다. 직원들이 안티인가요?
ID_04499,"부산역 근처라 이동 편하고, 오션뷰가 너무 좋았던 브라운스위트 부산 초고층 레지던스 호텔  부산 여행하면서 이 숙소에 묵었는데, 생각보다 괜찮아서 리뷰 남겨요. 일단 KTX 부산역에서 진짜 가까워서  캐리어를 끌고 가기에도 전혀 무리가 없었어요. 숙소 가는 길도 안내 문자에 상세하게 나와 있어서 길 찾는 데 전혀 문제 없었고요 . 방에 들어가자마자 가장 마음에 들었던 건 오션뷰!  창밖으로 바다가 딱 보이는데, 여행 온 기분도 나고 뭔가 여유로운 느낌이 들어서 좋았어요. 날씨 좋을 때는 창문을 열어놓고 바다 보면서 멍 때리기도 했네요 . 저희는 4명이서 같이 갔는데, 침대가 2개라서 충분히 넉넉했어요 . 서로 불편할 것도 없이 잘 수 있었고요. 그리고 취사 도구가 있어서 저녁에는 간단하게 요리해 먹고 , 아침에도 따로 나가지 않고 간단히 해결할 수 있었던 게 편리했어요 . 솔직히 큰 기대 없이 예약했는데, 교통도 편하고 방도 깔끔하고  오션뷰도 멋지고... 다음에 부산 오면 다시 여기 묵을 것 같아요 . 편안하게 잘 쉬다 갑니다!"
ID_01154,기념일이라 방문했는데 시설도 너무 좋고 무엇보다 깨끗해서 좋네요! 편안하고 조용해서 잘 쉬다가 왔어요ㅎㅎ
ID_02255,직원분들이 친절하고 숙소 컨디션 또한 좋았습니다! 로비 뷰가 아주 근사했어요.
ID_09874,객실 예약 문의하려고 전화하는데 전화 안 받고 수차례 걸니까 받더니 바로 끊어버리시네요.ㅎㅎㅎ 이 정도면 뭐... 숙박객한테 하는 서비스는 말 안 해도 알듯ㅋ
ID_03170,객실이 좁고 인심이 야박함
ID_07400,"직장 휴양소로 다녀왔습니다. 생각보다 컨디션도 괜찮고, 뷰도 나쁘지 않았어요. 조식도 쏘쏘, 위치도 좋고, 다음에 또 와야징ㅋ"
ID_10248,"위치 최고 - 지하철역, 해변, 시장 전부 가까운 곳   위치 청결 - 베드, 화장실 모두 깔끔했음. 만족!   미니 부엌이 있어서 배달 음식, 포장 음식 세팅할 때 무척 편했음!!   엘리베이터가 워낙 헬이라는 소문을 들어서 좀 나중에 체크인하고 이른 체크아웃을 해서 그런지 큰 문제는 없었음.   가성비 좋은 호텔이라 생각됨. 다시 방문하고 싶은 곳."
ID_07158,시설도 모든 게 최악... 낡고 더럽고 물이 쫄쫄 나와요. 겨울엔 난방도 개별 조절이 안 돼서 숨 막혀 죽을 뻔했어요.
ID_03108,"절대 가지 마세요. 1점도 아까워요. 객실에 비치되어 있던 드라이기가 전원 버튼을 켜자마자 들고 있던 손에서 폭발해서 하마터면 정말 크게 다칠 뻔했는데, 6~7년 동안 운영하면서 이런 경우가 없었다면서 주인분 태도가 정말 뻔뻔하시네요. 식기와 조리 도구들도 전에 사람이 쓰던 거 그대로 고기 기름이랑 초콜릿 다 묻어 있고 세척도 안 돼 있어요. 그리고 청소도 안 하는지 침대 밑이랑 천장, 냉장고 옆에 벌레 잡느라 고생했네요. 벌레 좋아하시는 분들은 꼭 가보세요. 강력 추천드립니다."
ID_04548,호텔에서 바로 보이는 광안대교랑 바다 뷰가 너무 힐링이 되는 경치입니다!! 호텔 내부도 깨끗하고 다음 부산 여행 시 또 방문하고 싶습니다 :)
ID_05423,주차는 좀 아쉬워요. 방이 넓어요.
ID_02049,깨끗해요. 작지만 외국인 많네요ㅠ
ID_09208,편안하게 쉴 수 있는 곳 (갈 때마다 날씨 운이 안 따라주는 곳) 최근 리뷰 > 이제는 못 가요... 객실 가격이 10-20은 오른 듯 합니다 ㅠㅠ
ID_08815,가성비가 좋긴 하지만 방이 너무 좁습니다. 그래도 깔끔하고 친절합니다.
ID_11033,"저렴한 가격에 연휴 기간 동안 편하게 숙박하고 왔습니다. 수영장 대기가 생각보다 적어서 편히 이용할 수 있었고, 오전에는 바다를 보고, 저녁에는 반짝이는 롯데월드 뷰가 너무 좋았습니다. 다만 객실 청소 상태가 좀 아쉬웠습니다. 이곳저곳에 먼지가 너무 많아서 한 번씩 환기가 필요했었습니다. 주차도 야간에 들어올 경우 자리가 없어서 지하 2층만으로는 주차가 어려웠습니다."
ID_00262,일단 8시 체크인이라 너무했음. 너무함. 탕도 좀 더러웠음. 기차 소리도 심함. 침대도 딱딱함. 근데 직원은 친절함. 대실만 해야 할 듯.
ID_04061,고풍스럽고 품격 있는 호텔. 무엇보다 손님에 대한 친절함이 피로를 잊게 해 줄 정도이다. 앞으로 자주 이용할 생각.
ID_05534,"기장의 명예를 실추시킨 참 치사하게 장사하는 곳, 가기 싫은 곳."
ID_06616,"다른 4성 호텔에 비교했을 때 서비스는 좋은 편인데, 체크아웃 시간에 엘리베이터가 최악의 치명적인 결점이다. 익스프레스 체크아웃을 해도 엘리베이터 잡기가 하늘의 별따기라서 비상구 계단으로 20층부터 걸어 내려옴ㅋㅋ"
ID_08120,간만에 보낸 오붓한 시간! 예약하고 보니 홈페이지에 할인 프로모션이 딱!... 이거 말고는 괜찮았어요 ㅎ
ID_08155,"프레지덴셜 스위트룸에서 숙박했는데, 너무 만족하고 좋았습니다. 무엇보다 깨끗했고, 직원들도 친절했습니다. 최대 7명까지 숙박이 가능해서 두 가족이 지내기에도 좋은 것 같습니다. 재방문의사 100%입니다."
ID_01802,침대가 허리가 아프고 방음이 안 되어 별로 좋지 않습니다. 남산 뷰와 한강 뷰는 좋네요. 숙박 시 무료로 제공되는 네스프레소 캡슐 커피나 와인 한 잔 하기에는 좋지만… 역시나 가성비는…
ID_04736,"뷰 맛집 호텔입니다. 한 달 전에 예약해서 제일 꼭대기층 배정받았어요. 여기 방 배정은 체크인 순서가 아니라 예약 순이라고 하더라고요. 흐린 날씨임에도 불구하고 뷰가 멋진 호텔입니다(트윈). 바다 바로 앞에 위치해 있고, 호텔 근처에 놀거리와 먹거리도 많아요. 직원들도 친절히 응대 잘해 주셨고 객실 상태도 양호했습니다. 호텔에서 샴페인 마시려고 가지고 갔는데 아이스 버킷과 글라스는 제공이 안 된다고 하니 참고해 주세요~"
ID_02385,"글램핑 노천탕. 시설도 좋고, 사장님 너무 친절하세요."
ID_06694,오래돼서 낡은 느낌은 있지만 클래식함
ID_05759,"프론트 남자 직원 한 분이 아주 불친절합니다. 살면서 체크인 이렇게 기분 나쁘게 하는 호텔은 처음 와보네요. 오징어 게임 가면을 쓴 게 불만인 건지, 그냥 원래 그런건지 일하기 싫어하는 티가 팍팍 나네요. 호텔 직원이 아니고 그냥 하루 알바 데려다 써도 그보다는 친절할 듯하네요. 위치나 시설은 좋지만 서비스는 기대하면 안 될 듯."
ID_01959,"전화 엄청 자주 하고, 뭐 하면 뭐 한다, 꿍시렁꿍시렁 진짜 어이가 없다. 몇 시간만 더 있겠다고 했더니, 일 박 요금 추가하면서 4시간 후에 나가라는 얘기까지 함 ㄷㄷ 최고의 역대급 호텔이었다……"
ID_02976,침대도 푹신하고 욕조도 있으며 가성비도 좋고 지하철역 바로 앞에 있어 여러모로 만족했습니다.
ID_08680,"건물은 깔끔하고, 내부 가구류의 유지보수는 열악합니다(문짝이 벌어지고 안 맞음). 결정적인 단점은 주변 환경이 최악입니다(쓰레기 천지, 만취자 천국, 더러운 식당가...). 재방문하지 않겠습니다."
ID_01843,"2성급 호텔. 딱 그 정도. 일반 외국 프랜차이즈 호텔에서 느끼는 그런 느낌은 없어요. 그냥 전망 좋은 모텔 분위기. 씨뷰는 확실히 전망이 좋긴 해요. 하지만 좀 오래된 느낌이고, 침대 중간 스프링이 나가서 쑥 들어가고요. 침구류는 너무 오래되어서 뻣뻣한 느낌이에요. 덮는 이불은 완전 무거워요. 타올은 끝자락이 다 헤어질 정도예요. 교체 좀 하시지, 정말 아쉽네요. 체크인 시 카드 키도 최초에 1장 주더라고요. 2명이었음에도 불구하고. 객실에 가서 한 장 더 주라 해서 받았어요. 다른 호텔은 혼자가도 2장 주더만요. 오전 8시 반에 객실을 나와 보니 벌써부터 청소하려고 각 객실 앞에 세탁물 자루를 갖다 놓고 청소하시는 분이 왔다 갔다 하더라고요. 이런 호텔? 처음 봤어요. 11시 이후에 좀 하던지. 암튼 진짜 여관에 온 것 같았어요. 체크인 전 캐리어 맡기러 들렀더니 프런트 데스크 직원도 표정이 진짜 안 좋고요. 재방문 의사 없어요. 혹시 호텔 수준의 서비스를 원하신다면 국내외 프랜차이즈 호텔 가세요. 저도 이런 곳 한번 와봤는데 앞으로는..."
ID_01734,"조식도 깔끔하고, 루프탑 근처 카페보다 좋습니다. 시설과 친절 모두 최고입니다. 루프탑 야경!"
ID_02911,더 파크뷰에서 맛있게 먹었어요.
ID_08338,티비로 넷플릭스 같은 게 연결되지 않는 점이 아쉬웠어요ㅜ
ID_01986,"공기가 좋고, 사장님이 친절하시고, 샤워실 물도 잘 나오고 무엇보다 침구류가 너무 편했던 것 같습니다. 그런데 매너 시간 11시 넘어서 엄청 떠드는 사람들 관리가 안 되는 것과 해 뜰 무렵 까마귀가 한 30마리 짖어대는 것 같아서 잠은 설쳤네요."
ID_09561,친절하고 방이 커서 좋았습니다~
